number,value,datetime_start,datetime_complete,duration,params_C,params_penalty,state
0,0.5106709591062922,2026-07-08 13:35:08.556365,2026-07-08 13:35:08.892105,0 days 00:00:00.335740,0.0745934328572655,l1,COMPLETE
1,0.49057614195984045,2026-07-08 13:35:08.892163,2026-07-08 13:35:09.317983,0 days 00:00:00.425820,0.9846738873614566,l1,COMPLETE
2,0.3065422763245529,2026-07-08 13:35:09.318033,2026-07-08 13:35:09.534587,0 days 00:00:00.216554,0.0019517224641449498,l1,COMPLETE
3,0.479174272505717,2026-07-08 13:35:09.534633,2026-07-08 13:35:09.803502,0 days 00:00:00.268869,3.4702669886504163,l2,COMPLETE
4,0.4797346160637915,2026-07-08 13:35:09.803582,2026-07-08 13:35:10.623080,0 days 00:00:00.819498,14.528246637516036,l1,COMPLETE
5,0.4986714358179988,2026-07-08 13:35:10.623120,2026-07-08 13:35:10.859644,0 days 00:00:00.236524,0.008260808399079604,l2,COMPLETE
6,0.4914699771238211,2026-07-08 13:35:10.859686,2026-07-08 13:35:11.108422,0 days 00:00:00.248736,0.14445251022763064,l2,COMPLETE
7,0.4961071362448012,2026-07-08 13:35:11.108467,2026-07-08 13:35:11.340218,0 days 00:00:00.231751,0.004982752357076452,l2,COMPLETE
8,0.5049329637610278,2026-07-08 13:35:11.340259,2026-07-08 13:35:11.594322,0 days 00:00:00.254063,0.19069966103000435,l1,COMPLETE
9,0.4998093460721488,2026-07-08 13:35:11.594361,2026-07-08 13:35:11.884580,0 days 00:00:00.290219,0.37253938395788866,l1,COMPLETE
10,0.47989441607081745,2026-07-08 13:35:11.884621,2026-07-08 13:35:13.190581,0 days 00:00:01.305960,57.23510936899938,l1,COMPLETE
11,0.5131575450423765,2026-07-08 13:35:13.190623,2026-07-08 13:35:13.430192,0 days 00:00:00.239569,0.049722859533622474,l1,COMPLETE
12,0.5131987551883822,2026-07-08 13:35:13.430234,2026-07-08 13:35:13.664570,0 days 00:00:00.234336,0.045507981434385704,l1,COMPLETE
13,0.5138152325801149,2026-07-08 13:35:13.664612,2026-07-08 13:35:13.892863,0 days 00:00:00.228251,0.02436959896422605,l1,COMPLETE
14,0.5131081605231287,2026-07-08 13:35:13.892901,2026-07-08 13:35:14.120553,0 days 00:00:00.227652,0.019029347838199786,l1,COMPLETE
15,0.3065422763245529,2026-07-08 13:35:14.120602,2026-07-08 13:35:14.347056,0 days 00:00:00.226454,0.0013340441642185773,l1,COMPLETE
16,0.513508975803235,2026-07-08 13:35:14.347100,2026-07-08 13:35:14.577199,0 days 00:00:00.230099,0.02575483495500518,l1,COMPLETE
17,0.5168914653247861,2026-07-08 13:35:14.577238,2026-07-08 13:35:14.808664,0 days 00:00:00.231426,0.012874464442379248,l1,COMPLETE
18,0.49739265215275896,2026-07-08 13:35:14.808726,2026-07-08 13:35:15.064090,0 days 00:00:00.255364,0.006313486264438975,l2,COMPLETE
19,0.4954239061864658,2026-07-08 13:35:15.064131,2026-07-08 13:35:15.532094,0 days 00:00:00.467963,0.6673670563658228,l1,COMPLETE
20,0.5169880865795968,2026-07-08 13:35:15.532135,2026-07-08 13:35:15.754380,0 days 00:00:00.222245,0.01117183983440211,l1,COMPLETE
21,0.516751505256259,2026-07-08 13:35:15.754421,2026-07-08 13:35:15.973269,0 days 00:00:00.218848,0.01253327068864769,l1,COMPLETE
22,0.40798543262092973,2026-07-08 13:35:15.973310,2026-07-08 13:35:16.193044,0 days 00:00:00.219734,0.003495786544047747,l1,COMPLETE
23,0.5169234990886348,2026-07-08 13:35:16.193084,2026-07-08 13:35:16.418736,0 days 00:00:00.225652,0.010976921589853826,l1,COMPLETE
24,0.4020744554062712,2026-07-08 13:35:16.418781,2026-07-08 13:35:16.647094,0 days 00:00:00.228313,0.002502806287895297,l1,COMPLETE
25,0.23696206831044755,2026-07-08 13:35:16.647134,2026-07-08 13:35:16.868498,0 days 00:00:00.221364,0.0010492468048220462,l1,COMPLETE
26,0.49878257731896486,2026-07-08 13:35:16.868583,2026-07-08 13:35:17.113130,0 days 00:00:00.244547,0.009988231434817958,l2,COMPLETE
27,0.5087327007696228,2026-07-08 13:35:17.113171,2026-07-08 13:35:17.349338,0 days 00:00:00.236167,0.10324855103017845,l1,COMPLETE
28,0.5134866627530126,2026-07-08 13:35:17.349379,2026-07-08 13:35:17.574164,0 days 00:00:00.224785,0.004642343444102008,l1,COMPLETE
29,0.5123160552925707,2026-07-08 13:35:17.574209,2026-07-08 13:35:17.812621,0 days 00:00:00.238412,0.05967899189493011,l1,COMPLETE
30,0.5140584931365673,2026-07-08 13:35:17.812664,2026-07-08 13:35:18.040166,0 days 00:00:00.227502,0.027478768227085032,l1,COMPLETE
31,0.5165644201119202,2026-07-08 13:35:18.040212,2026-07-08 13:35:18.264382,0 days 00:00:00.224170,0.013325084112853427,l1,COMPLETE
32,0.5169734453752102,2026-07-08 13:35:18.264421,2026-07-08 13:35:18.488423,0 days 00:00:00.224002,0.011438539267453422,l1,COMPLETE
33,0.4020744554062712,2026-07-08 13:35:18.488466,2026-07-08 13:35:18.710549,0 days 00:00:00.222083,0.002315319130273424,l1,COMPLETE
34,0.5180320550950998,2026-07-08 13:35:18.710589,2026-07-08 13:35:18.935985,0 days 00:00:00.225396,0.007903550181642046,l1,COMPLETE
35,0.5162903789012074,2026-07-08 13:35:18.936079,2026-07-08 13:35:19.159175,0 days 00:00:00.223096,0.006063459730213363,l1,COMPLETE
36,0.48278953487472775,2026-07-08 13:35:19.159220,2026-07-08 13:35:19.649914,0 days 00:00:00.490694,2.8368186335215775,l1,COMPLETE
37,0.4983010543211803,2026-07-08 13:35:19.649954,2026-07-08 13:35:19.894768,0 days 00:00:00.244814,0.03696342262068782,l2,COMPLETE
38,0.502487871900011,2026-07-08 13:35:19.894808,2026-07-08 13:35:20.168888,0 days 00:00:00.274080,0.26520326507312986,l1,COMPLETE
39,0.4924400645041157,2026-07-08 13:35:20.168933,2026-07-08 13:35:20.396966,0 days 00:00:00.228033,0.0032110828907444705,l2,COMPLETE
